{
  "name": "livekit",
  "display_name": "LiveKit",
  "category": "Voice & Multimodal",
  "rank": 100,
  "description": "Real-time voice/video WebRTC infrastructure for building AI voice assistants and conversational AI bots. Requires UDP ports 50000-50100.",
  "interface": "livekit.<yourdomain>.com",
  "source": "https://github.com/livekit/livekit",
  "depends_on": [
    "redis"
  ]
}
