{
  "name": "python-runner",
  "display_name": "Python Runner",
  "category": "Code Runners",
  "rank": 100,
  "description": "Execution environment for running custom Python scripts and workflows, designed to integrate seamlessly with n8n.",
  "interface": "Internal only",
  "source": "https://github.com/n8n-io/n8n",
  "depends_on": []
}
