{
  "name": "caddy",
  "display_name": "Caddy Reverse Proxy",
  "category": "Gateways & Proxies",
  "rank": 10,
  "description": "Advanced Reverse Proxy and Web Server providing automatic SSL termination and routing for all hosted services.",
  "interface": "internal: http://caddy:80",
  "source": "https://caddyserver.com/",
  "depends_on": []
}
