{
  "name": "libretranslate",
  "display_name": "LibreTranslate",
  "category": "Speech, Language & Text",
  "rank": 100,
  "description": "Self-hosted, privacy-focused translation API supporting over 50 languages for text and document translation.",
  "interface": "translate.<yourdomain>.com",
  "source": "https://github.com/LibreTranslate/LibreTranslate",
  "depends_on": []
}
