{
  "name": "langfuse",
  "display_name": "Langfuse",
  "category": "Development Tools",
  "rank": 90,
  "description": "AI observability platform including Clickhouse and Minio, specialized for DSGVO compliance, German text processing, and entity recognition.",
  "interface": "internal: http://langfuse-web:3000",
  "source": "",
  "depends_on": [
    "postgres",
    "redis"
  ]
}
