{
  "name": "lightrag",
  "display_name": "LightRAG",
  "category": "RAG Systems",
  "rank": 100,
  "description": "Graph-based Retrieval-Augmented Generation (RAG) system specializing in entity extraction and automatic knowledge graph creation.",
  "interface": "lightrag.<yourdomain>.com",
  "source": "https://github.com/HKUDS/LightRAG",
  "depends_on": []
}
