{
  "name": "private-dns",
  "display_name": "Private DNS",
  "category": "Host Services",
  "rank": 100,
  "description": "CoreDNS instance providing private DNS resolution for internal services and mail server routing.",
  "interface": "N/A",
  "source": "https://github.com/coredns/coredns",
  "depends_on": []
}
