{
  "name": "paperless",
  "display_name": "Paperless",
  "category": "File & Document Management",
  "rank": 100,
  "description": "Community-supported document management system featuring OCR, AI-powered auto-tagging, full-text search, and GDPR compliance tools.",
  "interface": "docs.<yourdomain>.com",
  "source": "https://github.com/paperless-ngx/paperless-ngx",
  "depends_on": []
}
