{
  "name": "postiz",
  "display_name": "Postiz",
  "category": "Business Productivity",
  "rank": 100,
  "description": "Open-source social media scheduling and publishing platform with analytics and multi-account support.",
  "interface": "postiz.<yourdomain>.com",
  "source": "https://github.com/gitroomhq/postiz-app",
  "depends_on": [
    "postgres",
    "redis"
  ]
}
