{
  "name": "webhook-testing",
  "display_name": "Webhook Tester + Hoppscotch",
  "category": "Development Tools",
  "rank": 100,
  "description": "Debugging suite combining Webhook Tester and Hoppscotch for inspecting incoming webhooks and testing external service integrations.",
  "interface": "webhook-test.<yourdomain>.com",
  "source": "https://github.com/tarampampam/webhook-tester",
  "depends_on": [
    "mailpit"
  ]
}
