{
  "name": "postgres",
  "display_name": "PostgreSQL Database",
  "category": "Data Services",
  "rank": 100,
  "description": "Shared PostgreSQL database instance serving as the backend for n8n, Flowise, and other data-intensive applications.",
  "interface": "internal: tcp://postgres:5432",
  "source": "https://hub.docker.com/_/postgres",
  "depends_on": []
}
