{
  "name": "kimai",
  "display_name": "Kimai",
  "category": "Business Productivity",
  "rank": 100,
  "description": "Professional, DSGVO-compliant time tracking software featuring team timesheets, invoicing, 2FA security, and API access.",
  "interface": "time.<yourdomain>.com",
  "source": "https://github.com/kimai/kimai",
  "depends_on": []
}
