{
  "name": "opennotebook",
  "display_name": "Open Notebook",
  "category": "Search & Web Data",
  "rank": 100,
  "description": "AI-powered knowledge management tool (NotebookLM alternative) supporting multi-modal content, podcast generation, and 16+ AI models.",
  "interface": "notebook.<yourdomain>.com",
  "source": "https://github.com/lfnovo/open-notebook",
  "depends_on": []
}
