{
  "name": "openui",
  "display_name": "OpenUI",
  "category": "Development Tools",
  "rank": 100,
  "description": "Experimental AI frontend and UI generator for creating design systems, component libraries, and mockups.",
  "interface": "openui.<yourdomain>.com",
  "source": "https://github.com/wandb/openui",
  "depends_on": []
}
